{
  "SchemaVersion": "2.1",
  "BaselineVersion": "2026.09.17.2",
  "Name": "Entra App Exposure baseline",
  "Policy": {
    "Credential": {
      "LongLivedDays": 180,
      "ExpiringSoonDays": 30,
      "MaxActiveCredentials": 3
    },
    "Ownership": {
      "MinimumOwners": 2
    },
    "SensitiveApplicationPermissions": [
      {
        "ResourceAppId": "00000003-0000-0000-c000-000000000000",
        "PermissionValue": "Directory.ReadWrite.All"
      },
      {
        "ResourceAppId": "00000003-0000-0000-c000-000000000000",
        "PermissionValue": "AppRoleAssignment.ReadWrite.All"
      },
      {
        "ResourceAppId": "00000003-0000-0000-c000-000000000000",
        "PermissionValue": "RoleManagement.ReadWrite.Directory"
      },
      {
        "ResourceAppId": "00000003-0000-0000-c000-000000000000",
        "PermissionValue": "Policy.ReadWrite.ApplicationConfiguration"
      },
      {
        "ResourceAppId": "00000003-0000-0000-c000-000000000000",
        "PermissionValue": "Policy.ReadWrite.ConditionalAccess"
      },
      {
        "ResourceAppId": "00000003-0000-0000-c000-000000000000",
        "PermissionValue": "UserAuthenticationMethod.ReadWrite.All"
      },
      {
        "ResourceAppId": "00000003-0000-0000-c000-000000000000",
        "PermissionValue": "Application.ReadWrite.All"
      },
      {
        "ResourceAppId": "00000003-0000-0000-c000-000000000000",
        "PermissionValue": "DeviceManagementApps.ReadWrite.All"
      },
      {
        "ResourceAppId": "00000003-0000-0000-c000-000000000000",
        "PermissionValue": "DeviceManagementConfiguration.ReadWrite.All"
      },
      {
        "ResourceAppId": "00000003-0000-0000-c000-000000000000",
        "PermissionValue": "DeviceManagementManagedDevices.ReadWrite.All"
      },
      {
        "ResourceAppId": "00000003-0000-0000-c000-000000000000",
        "PermissionValue": "DeviceManagementServiceConfig.ReadWrite.All"
      },
      {
        "ResourceAppId": "00000003-0000-0000-c000-000000000000",
        "PermissionValue": "DeviceManagementRBAC.ReadWrite.All"
      },
      {
        "ResourceAppId": "00000003-0000-0000-c000-000000000000",
        "PermissionValue": "Device.ReadWrite.All"
      }
    ],
    "SensitiveDelegatedPermissions": [
      {
        "ResourceAppId": "00000003-0000-0000-c000-000000000000",
        "PermissionValue": "Directory.AccessAsUser.All"
      },
      {
        "ResourceAppId": "00000003-0000-0000-c000-000000000000",
        "PermissionValue": "Directory.ReadWrite.All"
      },
      {
        "ResourceAppId": "00000003-0000-0000-c000-000000000000",
        "PermissionValue": "Mail.ReadWrite"
      },
      {
        "ResourceAppId": "00000003-0000-0000-c000-000000000000",
        "PermissionValue": "Mail.Send"
      },
      {
        "ResourceAppId": "00000003-0000-0000-c000-000000000000",
        "PermissionValue": "Files.ReadWrite.All"
      },
      {
        "ResourceAppId": "00000003-0000-0000-c000-000000000000",
        "PermissionValue": "Sites.FullControl.All"
      },
      {
        "ResourceAppId": "00000003-0000-0000-c000-000000000000",
        "PermissionValue": "User.ReadWrite.All"
      },
      {
        "ResourceAppId": "00000003-0000-0000-c000-000000000000",
        "PermissionValue": "Policy.ReadWrite.ConditionalAccess"
      },
      {
        "ResourceAppId": "00000003-0000-0000-c000-000000000000",
        "PermissionValue": "UserAuthenticationMethod.ReadWrite.All"
      },
      {
        "ResourceAppId": "00000003-0000-0000-c000-000000000000",
        "PermissionValue": "Application.ReadWrite.All"
      },
      {
        "ResourceAppId": "00000003-0000-0000-c000-000000000000",
        "PermissionValue": "DeviceManagementApps.ReadWrite.All"
      },
      {
        "ResourceAppId": "00000003-0000-0000-c000-000000000000",
        "PermissionValue": "DeviceManagementConfiguration.ReadWrite.All"
      },
      {
        "ResourceAppId": "00000003-0000-0000-c000-000000000000",
        "PermissionValue": "DeviceManagementManagedDevices.ReadWrite.All"
      },
      {
        "ResourceAppId": "00000003-0000-0000-c000-000000000000",
        "PermissionValue": "DeviceManagementServiceConfig.ReadWrite.All"
      },
      {
        "ResourceAppId": "00000003-0000-0000-c000-000000000000",
        "PermissionValue": "DeviceManagementRBAC.ReadWrite.All"
      },
      {
        "ResourceAppId": "00000003-0000-0000-c000-000000000000",
        "PermissionValue": "Device.ReadWrite.All"
      }
    ],
    "Activity": {
      "MinimumReviewLookbackDays": 90,
      "MinimumIdentityAgeDays": 90,
      "ExcludeMicrosoftFirstParty": true,
      "ExcludedServicePrincipalTypes": [
        "ManagedIdentity"
      ]
    }
  },
  "Definitions": [
    {
      "Id": "EAE-DATA-SP-001",
      "Enabled": true,
      "Category": "DataQuality",
      "Severity": "Informational",
      "AppliesTo": "ServicePrincipal",
      "Title": "Incomplete service-principal evidence collection",
      "Rationale": "Unavailable evidence must remain distinguishable from a confirmed empty result so absence-based conclusions are not overstated.",
      "Recommendation": "Resolve the reported collection failure and rerun the affected identity before treating absence-based conclusions as authoritative.",
      "RequiredEvidence": [
        "CollectionState"
      ],
      "References": []
    },
    {
      "Id": "EAE-DATA-APP-001",
      "Enabled": true,
      "Category": "DataQuality",
      "Severity": "Informational",
      "AppliesTo": "ApplicationRegistration",
      "Title": "Incomplete application-registration evidence collection",
      "Rationale": "Application ownership and credential evidence is first-class assessment data and remains distinct from the linked service-principal relationship.",
      "Recommendation": "Resolve the reported collection failure and rerun before treating owner or credential conclusions as authoritative.",
      "RequiredEvidence": [
        "ApplicationCollectionState"
      ],
      "References": []
    },
    {
      "Id": "EAE-OAUTH-APP-001",
      "Enabled": true,
      "Category": "ApplicationPermission",
      "Severity": "High",
      "AppliesTo": "ServicePrincipal",
      "Title": "Sensitive application permissions present",
      "Rationale": "Application permissions operate without a signed-in user and represent standing application identity access.",
      "Recommendation": "Confirm each app-only grant is required for the workload and remove grants that are no longer justified.",
      "RequiredEvidence": [
        "ApplicationPermission"
      ],
      "References": [
        "https://learn.microsoft.com/entra/identity/enterprise-apps/manage-application-permissions"
      ]
    },
    {
      "Id": "EAE-OAUTH-DEL-001",
      "Enabled": true,
      "Category": "DelegatedPermission",
      "Severity": "High",
      "AppliesTo": "ServicePrincipal",
      "Title": "Sensitive tenant-wide delegated permissions present",
      "Rationale": "Tenant-wide delegated consent increases the user population for which the application can exercise the granted permissions.",
      "Recommendation": "Validate the business need and tenant-wide consent scope; reduce or remove delegated grants that are no longer required.",
      "RequiredEvidence": [
        "DelegatedPermission"
      ],
      "References": [
        "https://learn.microsoft.com/entra/identity/enterprise-apps/user-admin-consent-overview"
      ]
    },
    {
      "Id": "EAE-OAUTH-DEL-002",
      "Enabled": true,
      "Category": "DelegatedPermission",
      "Severity": "Medium",
      "AppliesTo": "ServicePrincipal",
      "Title": "Sensitive user-scoped delegated permissions present",
      "Rationale": "Delegated grants allow an application to act with a signed-in user context and should remain limited to justified permissions.",
      "Recommendation": "Validate the business need for each delegated grant and remove grants that are no longer required.",
      "RequiredEvidence": [
        "DelegatedPermission"
      ],
      "References": [
        "https://learn.microsoft.com/entra/identity/enterprise-apps/user-admin-consent-overview"
      ]
    },
    {
      "Id": "EAE-SP-OWNER-001",
      "Enabled": true,
      "Category": "Ownership",
      "Severity": "Medium",
      "AppliesTo": "ServicePrincipal",
      "Title": "Service principal has no owner",
      "Rationale": "Without an accountable owner, permission and lifecycle review can be delayed or missed.",
      "Recommendation": "Assign accountable current owners and include the enterprise application in normal ownership review.",
      "RequiredEvidence": [
        "CollectionState",
        "Owner"
      ],
      "References": [
        "https://learn.microsoft.com/entra/identity/enterprise-apps/overview-assign-app-owners"
      ]
    },
    {
      "Id": "EAE-SP-OWNER-002",
      "Enabled": true,
      "Category": "Ownership",
      "Severity": "Low",
      "AppliesTo": "ServicePrincipal",
      "Title": "Service principal has only one owner",
      "Rationale": "Microsoft recommends proactively monitoring applications to ensure at least two owners where possible, reducing dependency on one individual.",
      "Recommendation": "Where operationally appropriate, assign a second accountable owner.",
      "RequiredEvidence": [
        "CollectionState",
        "Owner"
      ],
      "References": [
        "https://learn.microsoft.com/entra/identity/enterprise-apps/overview-assign-app-owners"
      ]
    },
    {
      "Id": "EAE-SP-OWNER-003",
      "Enabled": true,
      "Category": "Ownership",
      "Severity": "Medium",
      "AppliesTo": "ServicePrincipal",
      "Title": "Disabled account owns service principal",
      "Rationale": "A disabled account cannot provide reliable ongoing accountability for the enterprise application.",
      "Recommendation": "Replace disabled owners with active accountable owners.",
      "RequiredEvidence": [